{
  "$schema": "../schemas/public-commit-activity.schema.json",
  "version": "1.0.0",
  "username": "afadlih",
  "source": "GitHub public commit API sample",
  "sample_limit_per_repository": 100,
  "latest_public_commit_at": "2026-08-05T05:57:52Z",
  "window": {
    "start": "2026-07-07",
    "end": "2026-08-05",
    "days": 30
  },
  "summary": {
    "sampled_commits": 185,
    "commits_in_window": 26,
    "active_days": 2,
    "repositories_with_commits": 6
  },
  "daily": [
    {
      "date": "2026-07-07",
      "commits": 0
    },
    {
      "date": "2026-07-08",
      "commits": 0
    },
    {
      "date": "2026-07-09",
      "commits": 0
    },
    {
      "date": "2026-07-10",
      "commits": 0
    },
    {
      "date": "2026-07-11",
      "commits": 0
    },
    {
      "date": "2026-07-12",
      "commits": 0
    },
    {
      "date": "2026-07-13",
      "commits": 0
    },
    {
      "date": "2026-07-14",
      "commits": 0
    },
    {
      "date": "2026-07-15",
      "commits": 0
    },
    {
      "date": "2026-07-16",
      "commits": 0
    },
    {
      "date": "2026-07-17",
      "commits": 0
    },
    {
      "date": "2026-07-18",
      "commits": 0
    },
    {
      "date": "2026-07-19",
      "commits": 0
    },
    {
      "date": "2026-07-20",
      "commits": 0
    },
    {
      "date": "2026-07-21",
      "commits": 0
    },
    {
      "date": "2026-07-22",
      "commits": 0
    },
    {
      "date": "2026-07-23",
      "commits": 0
    },
    {
      "date": "2026-07-24",
      "commits": 0
    },
    {
      "date": "2026-07-25",
      "commits": 0
    },
    {
      "date": "2026-07-26",
      "commits": 0
    },
    {
      "date": "2026-07-27",
      "commits": 0
    },
    {
      "date": "2026-07-28",
      "commits": 0
    },
    {
      "date": "2026-07-29",
      "commits": 0
    },
    {
      "date": "2026-07-30",
      "commits": 0
    },
    {
      "date": "2026-07-31",
      "commits": 0
    },
    {
      "date": "2026-08-01",
      "commits": 0
    },
    {
      "date": "2026-08-02",
      "commits": 0
    },
    {
      "date": "2026-08-03",
      "commits": 0
    },
    {
      "date": "2026-08-04",
      "commits": 7
    },
    {
      "date": "2026-08-05",
      "commits": 19
    }
  ],
  "repositories": [
    {
      "repository": "afadlih/smart-clothesline-iot-system",
      "sampled_commits": 100
    },
    {
      "repository": "afadlih/afadlih",
      "sampled_commits": 41
    },
    {
      "repository": "afadlih/Ahmad-Fadlih-Portfolio",
      "sampled_commits": 32
    },
    {
      "repository": "afadlih/Pemrograman_Berbasis_Framework_Semester_6",
      "sampled_commits": 7
    },
    {
      "repository": "afadlih/2341720069_ML_2025",
      "sampled_commits": 4
    }
  ]
}
